,InvoiceNo,Stock Code,Description,Quantity,InvoiceDate,UnitPrice,Customer ID,Country,TotalAmount,Age,Salary
267,521480,85028S,FRENCH CHATEAU SMALL FRUITBOWL,36,06-09-2010 13:14,1.25,12779,Poland,45,23,56463
268,521480,85027L,FRENCH CHATEAU LARGE PLATTER ,24,06-09-2010 13:14,1.95,12779,Poland,46.8,23,56463
269,521651,22686,"FRENCH BLUE METAL DOOR SIGN, No",12,07-09-2010 13:41,1.25,12576,Poland,15,24,29134
270,521651,22678,"FRENCH BLUE METAL DOOR SIGN, 3",10,07-09-2010 13:42,1.25,12576,Poland,12.5,24,29134
271,521651,22679,"FRENCH BLUE METAL DOOR SIGN, 4",10,07-09-2010 13:42,1.25,12576,Poland,12.5,24,29134
272,521651,22680,"FRENCH BLUE METAL DOOR SIGN, 5",10,07-09-2010 13:42,1.25,12576,Poland,12.5,24,29134
273,521651,20658,RED SPOTTY LUGGAGE TAG,12,07-09-2010 13:42,1.25,12576,Poland,15,24,29134
274,521651,15056BL,EDWARDIAN PARASOL BLACK,3,07-09-2010 13:42,5.95,12576,Poland,17.85,24,29134
275,521651,84879,ASSORTED COLOUR BIRD ORNAMENT,8,07-09-2010 13:42,1.69,12576,Poland,13.52,24,29134
276,521651,21195,PINK  HONEYCOMB PAPER BALL ,6,07-09-2010 13:42,2.1,12576,Poland,12.6,24,29134
277,521651,16016,LARGE CHINESE STYLE SCISSOR,10,07-09-2010 13:42,0.85,12576,Poland,8.5,24,29134
278,521651,16014,SMALL CHINESE STYLE SCISSOR,20,07-09-2010 13:42,0.42,12576,Poland,8.4,24,29134
279,521651,21622,VINTAGE UNION JACK CUSHION COVER,4,07-09-2010 13:42,4.95,12576,Poland,19.8,24,29134
280,521651,22667,RECIPE BOX RETRO SPOT DESIGN,6,07-09-2010 13:42,2.95,12576,Poland,17.7,24,29134
281,521651,21892,TRADITIONAL WOODEN CATCH CUP GAME ,12,07-09-2010 13:42,1.25,12576,Poland,15,24,29134
282,523305,17084P,DRAGONS BLOOD INCENSE,25,21-09-2010 12:49,0.21,12751,Brazil,5.25,37,97197
283,523305,22659,LUNCH BOX I LOVE LONDON,1,21-09-2010 12:49,1.95,12751,Brazil,1.95,37,97197
284,523305,84406B,CREAM CUPID HEARTS COAT HANGER,1,21-09-2010 12:49,3.25,12751,Brazil,3.25,37,97197
285,523305,17091A,LAVENDER INCENSE IN TIN,1,21-09-2010 12:49,1.25,12751,Brazil,1.25,37,97197
286,523305,21124,SET/10 BLUE SPOTTY PARTY CANDLES,1,21-09-2010 12:49,1.25,12751,Brazil,1.25,37,97197
287,523305,21123,SET/10 IVORY SPOTTY PARTY CANDLES,1,21-09-2010 12:49,1.25,12751,Brazil,1.25,37,97197
288,523305,21121,SET/10 RED SPOTTY PARTY CANDLES,1,21-09-2010 12:49,1.25,12751,Brazil,1.25,37,97197
289,523305,22028,PENNY FARTHING BIRTHDAY CARD,12,21-09-2010 12:49,0.42,12751,Brazil,5.04,37,97197
290,523305,22630,DOLLY GIRL LUNCH BOX,1,21-09-2010 12:49,1.95,12751,Brazil,1.95,37,97197
291,523305,85123A,WHITE HANGING HEART T-LIGHT HOLDER,3,21-09-2010 12:49,2.95,12751,Brazil,8.85,37,97197
292,523305,22372,AIRLINE BAG VINTAGE WORLD CHAMPION ,4,21-09-2010 12:49,4.25,12751,Brazil,17,37,97197
293,523305,22951,60 CAKE CASES DOLLY GIRL DESIGN,1,21-09-2010 12:49,0.55,12751,Brazil,0.55,37,97197
294,523305,21212,PACK OF 72 RETRO SPOT CAKE CASES,2,21-09-2010 12:49,0.55,12751,Brazil,1.1,37,97197
295,523305,82001S,VINYL RECORD FRAME SILVER,1,21-09-2010 12:49,3.75,12751,Brazil,3.75,37,97197
296,523305,21324,HANGING MEDINA LANTERN SMALL,3,21-09-2010 12:49,2.95,12751,Brazil,8.85,37,97197
297,523305,85023B,EAU DE NILE JEWELLED PHOTOFRAME,2,21-09-2010 12:49,2.55,12751,Brazil,5.1,37,97197
298,523305,85024B,EAU DE NILE JEWELLED PHOTOFRAME,2,21-09-2010 12:49,1.65,12751,Brazil,3.3,37,97197
299,523305,85062,PEARL CRYSTAL PUMPKIN T-LIGHT HLDR,6,21-09-2010 12:49,1.65,12751,Brazil,9.9,37,97197
300,523305,84970S,HANGING HEART ZINC T-LIGHT HOLDER,12,21-09-2010 12:49,0.85,12751,Brazil,10.2,37,97197
301,523305,22178,VICTORIAN GLASS HANGING T-LIGHT,6,21-09-2010 12:49,1.25,12751,Brazil,7.5,37,97197
302,523305,21900,"KEY FOB , SHED",1,21-09-2010 12:49,0.65,12751,Brazil,0.65,37,97197
303,523305,21901,"KEY FOB , BACK DOOR ",1,21-09-2010 12:49,0.65,12751,Brazil,0.65,37,97197
304,523305,84832,ZINC WILLIE WINKIE  CANDLE STICK,3,21-09-2010 12:49,0.85,12751,Brazil,2.55,37,97197
305,523305,21166,COOK WITH WINE METAL SIGN ,2,21-09-2010 12:49,1.95,12751,Brazil,3.9,37,97197
306,523305,22412,METAL SIGN NEIGHBOURHOOD WITCH ,1,21-09-2010 12:49,2.1,12751,Brazil,2.1,37,97197
307,523305,22115,METAL SIGN EMPIRE TEA,3,21-09-2010 12:49,2.95,12751,Brazil,8.85,37,97197
308,523305,21679,SKULLS  STICKERS,1,21-09-2010 12:49,0.85,12751,Brazil,0.85,37,97197
309,523305,84991,60 TEATIME FAIRY CAKE CASES,2,21-09-2010 12:49,0.55,12751,Brazil,1.1,37,97197
310,523305,22336,DOVE DECORATION PAINTED ZINC ,4,21-09-2010 12:49,0.65,12751,Brazil,2.6,37,97197
311,523305,85124B,BLUE JUICY FRUIT PHOTO FRAME,2,21-09-2010 12:49,2.55,12751,Brazil,5.1,37,97197
312,523305,85124C,GREEN JUICY FRUIT PHOTO FRAME,2,21-09-2010 12:49,2.55,12751,Brazil,5.1,37,97197
313,523305,84849A,HELLO SAILOR BLUE SOAP HOLDER,1,21-09-2010 12:49,1.69,12751,Brazil,1.69,37,97197
314,523305,21864,UNION JACK FLAG PASSPORT COVER ,1,21-09-2010 12:49,2.1,12751,Brazil,2.1,37,97197
315,523305,20839,FRENCH PAISLEY CUSHION COVER ,6,21-09-2010 12:49,2.95,12751,Brazil,17.7,37,97197
316,523305,84620,BLUE GINGHAM ROSE CUSHION COVER,2,21-09-2010 12:49,5.95,12751,Brazil,11.9,37,97197
317,523305,84658,WHITE STITCHED CUSHION COVER,1,21-09-2010 12:49,6.95,12751,Brazil,6.95,37,97197
318,523305,21774,DECORATIVE CATS BATHROOM BOTTLE,1,21-09-2010 12:49,1.25,12751,Brazil,1.25,37,97197
319,523305,82482,WOODEN PICTURE FRAME WHITE FINISH,3,21-09-2010 12:49,2.55,12751,Brazil,7.65,37,97197
320,523305,17107D,"FLOWER FAIRY,5 SUMMER B'DRAW LINERS",1,21-09-2010 12:49,2.55,12751,Brazil,2.55,37,97197
321,523305,22082,RIBBON REEL STRIPES DESIGN ,1,21-09-2010 12:49,1.65,12751,Brazil,1.65,37,97197
322,523305,21866,UNION JACK FLAG LUGGAGE TAG,1,21-09-2010 12:49,1.25,12751,Brazil,1.25,37,97197
323,523305,22077,6 RIBBONS RUSTIC CHARM,4,21-09-2010 12:49,1.65,12751,Brazil,6.6,37,97197
324,523305,62018,SOMBRERO ,1,21-09-2010 12:49,1.95,12751,Brazil,1.95,37,97197
325,523305,20669,RED HEART LUGGAGE TAG,2,21-09-2010 12:49,1.25,12751,Brazil,2.5,37,97197
326,523305,35819B,"ACRYLIC HANGING JEWEL,BLUE",3,21-09-2010 12:49,1.25,12751,Brazil,3.75,37,97197
327,523305,22336,DOVE DECORATION PAINTED ZINC ,3,21-09-2010 12:49,0.65,12751,Brazil,1.95,37,97197
328,523305,22156,HEART DECORATION WITH PEARLS ,3,21-09-2010 12:49,0.85,12751,Brazil,2.55,37,97197
329,523305,21811,CHRISTMAS HANGING HEART WITH BELL,4,21-09-2010 12:49,1.25,12751,Brazil,5,37,97197
330,523305,84879,ASSORTED COLOUR BIRD ORNAMENT,6,21-09-2010 12:49,1.69,12751,Brazil,10.14,37,97197
331,523305,21812,GARLAND WITH HEARTS AND BELLS,2,21-09-2010 12:49,4.95,12751,Brazil,9.9,37,97197
332,523305,22335,HEART DECORATION PAINTED ZINC ,7,21-09-2010 12:49,0.65,12751,Brazil,4.55,37,97197
333,523305,22219,LOVEBIRD HANGING DECORATION WHITE ,3,21-09-2010 12:49,0.85,12751,Brazil,2.55,37,97197
334,523305,85017B,ENVELOPE 50 BLOSSOM IMAGES,3,21-09-2010 12:49,0.85,12751,Brazil,2.55,37,97197
335,523305,21190,PINK HEARTS PAPER GARLAND,1,21-09-2010 12:49,1.65,12751,Brazil,1.65,37,97197
336,523305,22088,PAPER BUNTING COLOURED LACE,1,21-09-2010 12:49,2.95,12751,Brazil,2.95,37,97197
337,523305,84987,SET OF 36 TEATIME PAPER DOILIES,1,21-09-2010 12:49,1.45,12751,Brazil,1.45,37,97197
338,523305,21210,SET OF 72 RETRO SPOT PAPER  DOILIES,1,21-09-2010 12:49,1.45,12751,Brazil,1.45,37,97197
339,523305,22337,ANGEL DECORATION PAINTED ZINC ,5,21-09-2010 12:49,0.65,12751,Brazil,3.25,37,97197
340,523305,22338,STAR DECORATION PAINTED ZINC ,4,21-09-2010 12:49,0.65,12751,Brazil,2.6,37,97197
341,523305,22339,CHRISTMAS TREE PAINTED ZINC ,5,21-09-2010 12:49,0.65,12751,Brazil,3.25,37,97197
342,523305,22164,STRING OF STARS CARD HOLDER,2,21-09-2010 12:49,2.95,12751,Brazil,5.9,37,97197
343,523305,22604,SET OF 4 NAPKIN CHARMS CUTLERY,2,21-09-2010 12:49,2.55,12751,Brazil,5.1,37,97197
344,529161,22449,SILK PURSE BABUSHKA PINK,6,26-10-2010 17:23,3.35,15390,Canada,20.1,67,71979
345,529161,21506,"FANCY FONT BIRTHDAY CARD, ",12,26-10-2010 17:23,0.42,15390,Canada,5.04,67,71979
346,529161,20978,36 PENCILS TUBE SKULLS,16,26-10-2010 17:23,1.25,15390,Canada,20,67,71979
347,529161,21558,SKULL LUNCH BOX WITH CUTLERY ,6,26-10-2010 17:23,2.55,15390,Canada,15.3,67,71979
348,529161,21967,PACK OF 12 SKULL TISSUES,24,26-10-2010 17:23,0.29,15390,Canada,6.96,67,71979
349,529161,22553,PLASTERS IN TIN SKULLS,12,26-10-2010 17:23,1.65,15390,Canada,19.8,67,71979
350,529161,20979,36 PENCILS TUBE RED RETROSPOT,16,26-10-2010 17:23,1.25,15390,Canada,20,67,71979
351,529161,21212,PACK OF 72 RETROSPOT CAKE CASES,24,26-10-2010 17:23,0.55,15390,Canada,13.2,67,71979
352,529161,21156,RETROSPOT CHILDRENS APRON,16,26-10-2010 17:23,1.95,15390,Canada,31.2,67,71979
353,529161,21584,RETROSPOT SMALL TUBE MATCHES,20,26-10-2010 17:23,1.65,15390,Canada,33,67,71979
354,529161,22083,PAPER CHAIN KIT RETROSPOT,6,26-10-2010 17:23,2.95,15390,Canada,17.7,67,71979
355,529161,21980,PACK OF 12 RED RETROSPOT TISSUES,24,26-10-2010 17:23,0.29,15390,Canada,6.96,67,71979
356,529161,22632,HAND WARMER RED RETROSPOT,12,26-10-2010 17:23,2.1,15390,Canada,25.2,67,71979
357,529161,21232,STRAWBERRY CERAMIC TRINKET BOX,12,26-10-2010 17:23,1.25,15390,Canada,15,67,71979
358,529161,21555,CERAMIC STRAWBERRY TRINKET TRAY,6,26-10-2010 17:23,2.55,15390,Canada,15.3,67,71979
359,529161,22645,CERAMIC HEART FAIRY CAKE MONEY BANK,12,26-10-2010 17:23,1.45,15390,Canada,17.4,67,71979
360,529161,35924,HANGING FAIRY CAKE DECORATION,6,26-10-2010 17:23,2.1,15390,Canada,12.6,67,71979
361,529161,47591D,PINK FAIRY CAKE CHILDRENS APRON,8,26-10-2010 17:23,1.95,15390,Canada,15.6,67,71979
362,529161,21114,LAVENDER SCENTED FABRIC HEART,20,26-10-2010 17:23,1.25,15390,Canada,25,67,71979
363,529161,22367,CHILDRENS APRON SPACEBOY DESIGN,8,26-10-2010 17:23,1.95,15390,Canada,15.6,67,71979
364,529161,22417,PACK OF 60 SPACEBOY CAKE CASES,24,26-10-2010 17:23,0.55,15390,Canada,13.2,67,71979
365,529161,22551,PLASTERS IN TIN SPACEBOY,12,26-10-2010 17:23,1.65,15390,Canada,19.8,67,71979
366,529161,22614,PACK OF 12 SPACEBOY TISSUES,24,26-10-2010 17:23,0.29,15390,Canada,6.96,67,71979
367,529161,21986,PACK OF 12 PINK POLKADOT TISSUES,24,26-10-2010 17:23,0.29,15390,Canada,6.96,67,71979
368,529161,21577,SAVE THE PLANET COTTON TOTE BAG,12,26-10-2010 17:23,2.25,15390,Canada,27,67,71979
369,529161,22557,PLASTERS IN TIN VINTAGE PAISLEY ,12,26-10-2010 17:23,1.65,15390,Canada,19.8,67,71979
370,529161,22090,PAPER BUNTING RETROSPOT,6,26-10-2010 17:23,2.95,15390,Canada,17.7,67,71979
371,529161,22318,FIVE HEART HANGING DECORATION,6,26-10-2010 17:23,2.95,15390,Canada,17.7,67,71979
372,529161,21408,SPOTTY PINK DUCK DOORSTOP,3,26-10-2010 17:23,4.25,15390,Canada,12.75,67,71979
373,529161,21975,PACK OF 60 DINOSAUR CAKE CASES,24,26-10-2010 17:23,0.55,15390,Canada,13.2,67,71979
374,529161,21977,PACK OF 60 PINK PAISLEY CAKE CASES,24,26-10-2010 17:23,0.55,15390,Canada,13.2,67,71979
375,529161,21871,SAVE THE PLANET MUG,12,26-10-2010 17:23,1.25,15390,Canada,15,67,71979
376,529161,21559,STRAWBERRY LUNCH BOX WITH CUTLERY,6,26-10-2010 17:23,2.55,15390,Canada,15.3,67,71979
377,529161,22983,"CARD, BILLBOARD FONT",12,26-10-2010 17:23,0.42,15390,Canada,5.04,67,71979
378,529161,21846,PINK DIAMANTE PEN IN GIFT BOX,24,26-10-2010 17:23,1.25,15390,Canada,30,67,71979
379,529161,22910,PAPER CHAIN KIT VINTAGE CHRISTMAS,6,26-10-2010 17:23,2.95,15390,Canada,17.7,67,71979
380,529161,22276,WASH BAG VINTAGE ROSE PAISLEY,6,26-10-2010 17:23,2.55,15390,Canada,15.3,67,71979
381,529161,20682,RED RETROSPOT CHILDRENS UMBRELLA,6,26-10-2010 17:23,3.25,15390,Canada,19.5,67,71979
382,529161,85025B,EAU DE NILE HEART SHAPE PHOTO FRAME,12,26-10-2010 17:23,1.65,15390,Canada,19.8,67,71979
383,529161,85023B,EAU DE NILE JEWELLED PHOTOFRAME,6,26-10-2010 17:23,2.55,15390,Canada,15.3,67,71979
384,529161,22321,BIRD DECORATION RED RETROSPOT,12,26-10-2010 17:23,0.85,15390,Canada,10.2,67,71979
385,529161,22344,PARTY PIZZA DISH PINK POLKADOT,12,26-10-2010 17:23,0.85,15390,Canada,10.2,67,71979
386,529161,21242,RED RETROSPOT PLATE ,16,26-10-2010 17:23,1.69,15390,Canada,27.04,67,71979
387,529161,21243,PINK  POLKADOT PLATE ,16,26-10-2010 17:23,1.69,15390,Canada,27.04,67,71979
388,529161,21244,BLUE POLKADOT PLATE ,16,26-10-2010 17:23,1.69,15390,Canada,27.04,67,71979
389,529161,21238,RED RETROSPOT CUP,16,26-10-2010 17:23,0.85,15390,Canada,13.6,67,71979
390,529161,21239,PINK  POLKADOT CUP,16,26-10-2010 17:23,0.85,15390,Canada,13.6,67,71979
391,529161,21240,BLUE POLKADOT CUP,16,26-10-2010 17:23,0.85,15390,Canada,13.6,67,71979
392,529161,22343,PARTY PIZZA DISH RED RETROSPOT,12,26-10-2010 17:23,0.85,15390,Canada,10.2,67,71979
393,529161,22345,PARTY PIZZA DISH BLUE POLKADOT,12,26-10-2010 17:23,0.85,15390,Canada,10.2,67,71979
394,529924,22698,PINK REGENCY TEACUP AND SAUCER,6,31-10-2010 14:20,2.95,12347,Iceland,17.7,53,98522
395,529924,22699,ROSES REGENCY TEACUP AND SAUCER ,6,31-10-2010 14:20,2.95,12347,Iceland,17.7,53,98522
396,529924,20985,HEART CALCULATOR,12,31-10-2010 14:20,1.25,12347,Iceland,15,53,98522
397,529924,22418,10 COLOUR SPACEBOY PEN,24,31-10-2010 14:20,0.85,12347,Iceland,20.4,53,98522
398,529924,22422,TOOTHPASTE TUBE PEN,12,31-10-2010 14:20,0.65,12347,Iceland,7.8,53,98522
399,529924,51014A,"FEATHER PEN,HOT PINK",12,31-10-2010 14:20,0.85,12347,Iceland,10.2,53,98522
400,529924,51014C,"FEATHER PEN,COAL BLACK",12,31-10-2010 14:20,0.85,12347,Iceland,10.2,53,98522
401,529924,51014L,"FEATHER PEN,LIGHT PINK",12,31-10-2010 14:20,0.85,12347,Iceland,10.2,53,98522
402,529924,22709,WRAP WEDDING DAY,25,31-10-2010 14:20,0.42,12347,Iceland,10.5,53,98522
403,529924,22045,SPACEBOY GIFT WRAP,25,31-10-2010 14:20,0.42,12347,Iceland,10.5,53,98522
404,529924,84558A,3D DOG PICTURE PLAYING CARDS,6,31-10-2010 14:20,2.95,12347,Iceland,17.7,53,98522
405,529924,22534,MAGIC DRAWING SLATE SPACEBOY ,24,31-10-2010 14:20,0.42,12347,Iceland,10.08,53,98522
406,529924,22530,MAGIC DRAWING SLATE DOLLY GIRL ,24,31-10-2010 14:20,0.42,12347,Iceland,10.08,53,98522
407,529924,22196,SMALL HEART MEASURING SPOONS,12,31-10-2010 14:20,0.85,12347,Iceland,10.2,53,98522
408,529924,21739,COSY SLIPPER SHOES SMALL GREEN,6,31-10-2010 14:20,2.95,12347,Iceland,17.7,53,98522
409,529924,21741,COSY SLIPPER SHOES LARGE GREEN,6,31-10-2010 14:20,2.95,12347,Iceland,17.7,53,98522
410,529924,47594A,CAROUSEL DESIGN WASHBAG,6,31-10-2010 14:20,1.95,12347,Iceland,11.7,53,98522
411,529924,20966,SANDWICH BATH SPONGE,10,31-10-2010 14:20,1.25,12347,Iceland,12.5,53,98522
412,529924,72819,CUPID DESIGN SCENTED CANDLES,6,31-10-2010 14:20,2.55,12347,Iceland,15.3,53,98522
413,529924,35471D,SET OF 3 BIRD LIGHT PINK FEATHER,12,31-10-2010 14:20,1.25,12347,Iceland,15,53,98522
414,529924,22244,3 HOOK HANGER MAGIC GARDEN,12,31-10-2010 14:20,1.95,12347,Iceland,23.4,53,98522
415,529924,22245,"HOOK, 1 HANGER ,MAGIC GARDEN",12,31-10-2010 14:20,0.85,12347,Iceland,10.2,53,98522
416,529924,47559B,TEA TIME OVEN GLOVE,10,31-10-2010 14:20,1.25,12347,Iceland,12.5,53,98522
417,529924,21976,PACK OF 60 MUSHROOM CAKE CASES,24,31-10-2010 14:20,0.55,12347,Iceland,13.2,53,98522
418,529924,84991,60 TEATIME FAIRY CAKE CASES,24,31-10-2010 14:20,0.55,12347,Iceland,13.2,53,98522
419,529924,84992,72 SWEETHEART FAIRY CAKE CASES,24,31-10-2010 14:20,0.55,12347,Iceland,13.2,53,98522
420,529924,22423,REGENCY CAKESTAND 3 TIER,3,31-10-2010 14:20,12.75,12347,Iceland,38.25,53,98522
421,529924,22697,GREEN REGENCY TEACUP AND SAUCER,6,31-10-2010 14:20,2.95,12347,Iceland,17.7,53,98522
422,529924,20712,JUMBO BAG WOODLAND ANIMALS,10,31-10-2010 14:20,1.95,12347,Iceland,19.5,53,98522
423,529924,21372,MIRRORED WALL ART TABLE LAMP,24,31-10-2010 14:20,0.85,12347,Iceland,20.4,53,98522
424,529924,21144,PINK POODLE HANGING DECORATION ,24,31-10-2010 14:20,0.38,12347,Iceland,9.12,53,98522
425,529924,84625A,PINK NEW BAROQUECANDLESTICK CANDLE,6,31-10-2010 14:20,2.95,12347,Iceland,17.7,53,98522
426,529924,84625C,BLUE NEW BAROQUE CANDLESTICK CANDLE,6,31-10-2010 14:20,2.95,12347,Iceland,17.7,53,98522
427,529924,84625D,WHITE NEWBAROQUE CANDLESTICK CANDLE,6,31-10-2010 14:20,2.95,12347,Iceland,17.7,53,98522
428,529924,21579,LOLITA  DESIGN  COTTON TOTE BAG,6,31-10-2010 14:20,2.25,12347,Iceland,13.5,53,98522
429,529924,21578,WOODLAND DESIGN  COTTON TOTE BAG,6,31-10-2010 14:20,2.25,12347,Iceland,13.5,53,98522
430,529924,20719,WOODLAND CHARLOTTE BAG,10,31-10-2010 14:20,0.85,12347,Iceland,8.5,53,98522
431,529924,22331,WOODLAND PARTY BAG + STICKER SET,16,31-10-2010 14:20,1.65,12347,Iceland,26.4,53,98522
432,529924,47599A,PINK PARTY BAGS,12,31-10-2010 14:20,2.1,12347,Iceland,25.2,53,98522
433,529924,20716,PARTY FOOD SHOPPER BAG,10,31-10-2010 14:20,1.25,12347,Iceland,12.5,53,98522
434,531495,22508,DOORSTOP RETROSPOT HEART,4,08-11-2010 15:19,3.75,15390,Canada,15,67,71979
435,531495,21328,BALLOONS  WRITING SET ,12,08-11-2010 15:19,1.65,15390,Canada,19.8,67,71979
436,531495,20996,JAZZ HEARTS ADDRESS BOOK,24,08-11-2010 15:19,0.42,15390,Canada,10.08,67,71979
437,531495,22505,MEMO BOARD COTTAGE DESIGN,4,08-11-2010 15:19,4.95,15390,Canada,19.8,67,71979
438,531495,20961,STRAWBERRY BATH SPONGE ,10,08-11-2010 15:19,1.25,15390,Canada,12.5,67,71979
439,531495,20966,SANDWICH BATH SPONGE,10,08-11-2010 15:19,1.25,15390,Canada,12.5,67,71979
440,531495,84946,ANTIQUE SILVER TEA GLASS ETCHED,12,08-11-2010 15:19,1.25,15390,Canada,15,67,71979
441,531495,21693,SMALL HAMMERED SILVER CANDLEPOT ,6,08-11-2010 15:19,2.95,15390,Canada,17.7,67,71979
442,531495,22139,RETROSPOT TEA SET CERAMIC 11 PC,3,08-11-2010 15:19,4.95,15390,Canada,14.85,67,71979
443,531495,22030,SWALLOWS GREETING CARD,12,08-11-2010 15:19,0.42,15390,Canada,5.04,67,71979
444,531495,22786,PILLOWCUSHION COVER PINK UNION JACK,2,08-11-2010 15:19,5.95,15390,Canada,11.9,67,71979
445,531495,20677,PINK POLKADOT BOWL,8,08-11-2010 15:19,1.25,15390,Canada,10,67,71979
446,531495,20675,BLUE POLKADOT BOWL,8,08-11-2010 15:19,1.25,15390,Canada,10,67,71979
447,531495,20676,RED RETROSPOT BOWL,8,08-11-2010 15:19,1.25,15390,Canada,10,67,71979
448,531495,22771,CLEAR DRAWER KNOB ACRYLIC EDWARDIAN,12,08-11-2010 15:19,1.25,15390,Canada,15,67,71979
449,531495,22513,DOORSTOP FOOTBALL DESIGN,4,08-11-2010 15:19,3.75,15390,Canada,15,67,71979
450,531495,21429,RED GINGHAM ROSE JEWELLERY BOX,8,08-11-2010 15:19,1.65,15390,Canada,13.2,67,71979
451,531495,84535B,FAIRY CAKES NOTEBOOK A6 SIZE,16,08-11-2010 15:19,0.65,15390,Canada,10.4,67,71979
452,531495,22580,ADVENT CALENDAR GINGHAM SACK,3,08-11-2010 15:19,5.95,15390,Canada,17.85,67,71979
453,531495,84950,ASSORTED COLOUR T-LIGHT HOLDER,12,08-11-2010 15:19,0.65,15390,Canada,7.8,67,71979
454,531495,85123A,WHITE HANGING HEART T-LIGHT HOLDER,6,08-11-2010 15:19,2.95,15390,Canada,17.7,67,71979
455,531495,22617,BAKING SET SPACEBOY DESIGN,3,08-11-2010 15:19,4.95,15390,Canada,14.85,67,71979
456,531495,85129B,BEADED CRYSTAL HEART GREEN SMALL,12,08-11-2010 15:19,1.25,15390,Canada,15,67,71979
457,531495,21107,CREAM SLICE FLANNEL PINK SPOT ,6,08-11-2010 15:19,2.95,15390,Canada,17.7,67,71979
458,531495,21111,"SWISS ROLL TOWEL, CHOCOLATE  SPOTS",6,08-11-2010 15:19,2.95,15390,Canada,17.7,67,71979
459,531495,21106,CREAM SLICE FLANNEL CHOCOLATE SPOT ,6,08-11-2010 15:19,2.95,15390,Canada,17.7,67,71979
460,531495,21112,"SWISS ROLL TOWEL, PINK  SPOTS",6,08-11-2010 15:19,2.95,15390,Canada,17.7,67,71979
461,532109,85232B,SET OF 3 BABUSHKA STACKING TINS,6,10-11-2010 16:40,4.95,12666,Israel,29.7,31,32916
462,532109,22358,KINGS CHOICE TEA CADDY ,12,10-11-2010 16:40,2.95,12666,Israel,35.4,31,32916
463,532109,22357,KINGS CHOICE BISCUIT TIN,6,10-11-2010 16:40,4.25,12666,Israel,25.5,31,32916
464,532109,22192,BLUE DINER WALL CLOCK,12,10-11-2010 16:40,7.65,12666,Israel,91.8,31,32916
465,532109,22191,IVORY DINER WALL CLOCK,24,10-11-2010 16:40,7.65,12666,Israel,183.6,31,32916
466,532109,22726,ALARM CLOCK BAKELIKE GREEN,8,10-11-2010 16:40,3.75,12666,Israel,30,31,32916
467,532109,22729,ALARM CLOCK BAKELIKE ORANGE,4,10-11-2010 16:40,3.75,12666,Israel,15,31,32916
468,532109,22727,ALARM CLOCK BAKELIKE RED ,4,10-11-2010 16:40,3.75,12666,Israel,15,31,32916
469,532109,21165,BEWARE OF THE CAT METAL SIGN ,12,10-11-2010 16:40,1.69,12666,Israel,20.28,31,32916
470,532109,22670,FRENCH WC SIGN BLUE METAL,24,10-11-2010 16:40,1.25,12666,Israel,30,31,32916
471,532109,22674,FRENCH TOILET SIGN BLUE METAL,12,10-11-2010 16:40,1.25,12666,Israel,15,31,32916
472,532109,22672,FRENCH BATHROOM SIGN BLUE METAL,12,10-11-2010 16:40,1.65,12666,Israel,19.8,31,32916
473,532109,22686,"FRENCH BLUE METAL DOOR SIGN, No",12,10-11-2010 16:40,1.25,12666,Israel,15,31,32916
474,532109,22685,"FRENCH BLUE METAL DOOR SIGN, 0",10,10-11-2010 16:40,1.25,12666,Israel,12.5,31,32916
475,532109,22684,"FRENCH BLUE METAL DOOR SIGN, 9",10,10-11-2010 16:40,1.25,12666,Israel,12.5,31,32916
476,532109,22683,"FRENCH BLUE METAL DOOR SIGN, 8",10,10-11-2010 16:40,1.25,12666,Israel,12.5,31,32916
477,532109,22682,"FRENCH BLUE METAL DOOR SIGN, 7",10,10-11-2010 16:40,1.25,12666,Israel,12.5,31,32916
478,532109,22681,"FRENCH BLUE METAL DOOR SIGN, 6",10,10-11-2010 16:40,1.25,12666,Israel,12.5,31,32916
479,532109,22680,"FRENCH BLUE METAL DOOR SIGN, 5",10,10-11-2010 16:40,1.25,12666,Israel,12.5,31,32916
480,532109,22679,"FRENCH BLUE METAL DOOR SIGN, 4",10,10-11-2010 16:40,1.25,12666,Israel,12.5,31,32916
481,532109,22678,"FRENCH BLUE METAL DOOR SIGN, 3",10,10-11-2010 16:40,1.25,12666,Israel,12.5,31,32916
482,532109,22677,"FRENCH BLUE METAL DOOR SIGN, 2",10,10-11-2010 16:40,1.25,12666,Israel,12.5,31,32916
483,532109,22676,"FRENCH BLUE METAL DOOR SIGN, 1",10,10-11-2010 16:40,1.25,12666,Israel,12.5,31,32916
484,532109,22690,DOORMAT HOME SWEET HOME BLUE ,10,10-11-2010 16:40,6.75,12666,Israel,67.5,31,32916
485,532109,48187,DOORMAT NEW ENGLAND,30,10-11-2010 16:40,6.75,12666,Israel,202.5,31,32916
486,532109,22457,NATURAL SLATE HEART CHALKBOARD ,12,10-11-2010 16:40,2.95,12666,Israel,35.4,31,32916
487,532109,22847,BREAD BIN DINER STYLE IVORY,1,10-11-2010 16:40,16.95,12666,Israel,16.95,31,32916
488,532109,22846,BREAD BIN DINER STYLE RED ,1,10-11-2010 16:40,16.95,12666,Israel,16.95,31,32916
489,532109,84792,ENCHANTED BIRD COATHANGER 5 HOOK,24,10-11-2010 16:40,3.81,12666,Israel,91.44,31,32916
490,532109,22474,SPACEBOY TV DINNER TRAY,32,10-11-2010 16:40,4.25,12666,Israel,136,31,32916
491,532109,82482,WOODEN PICTURE FRAME WHITE FINISH,12,10-11-2010 16:40,2.55,12666,Israel,30.6,31,32916
492,532556,22483,RED GINGHAM TEDDY BEAR ,6,12-11-2010 12:44,2.95,12576,Poland,17.7,24,29134
493,532556,21889,WOODEN BOX OF DOMINOES,12,12-11-2010 12:44,1.25,12576,Poland,15,24,29134
494,532556,22652,TRAVEL SEWING KIT,10,12-11-2010 12:44,1.65,12576,Poland,16.5,24,29134
495,532556,15056BL,EDWARDIAN PARASOL BLACK,3,12-11-2010 12:44,5.95,12576,Poland,17.85,24,29134
496,532556,21926,RED/CREAM STRIPE CUSHION COVER ,12,12-11-2010 12:44,1.25,12576,Poland,15,24,29134
497,532556,79000,MOROCCAN TEA GLASS,12,12-11-2010 12:44,0.85,12576,Poland,10.2,24,29134
498,532556,82580,BATHROOM METAL SIGN,12,12-11-2010 12:44,0.55,12576,Poland,6.6,24,29134
499,532556,22676,FRENCH BLUE METAL DOOR SIGN 1,10,12-11-2010 12:44,1.25,12576,Poland,12.5,24,29134
500,532556,22677,FRENCH BLUE METAL DOOR SIGN 2,10,12-11-2010 12:44,1.25,12576,Poland,12.5,24,29134
501,532556,22581,WOOD STOCKING CHRISTMAS SCANDISPOT,12,12-11-2010 12:44,0.85,12576,Poland,10.2,24,29134
502,532556,22602,CHRISTMAS RETROSPOT HEART WOOD,12,12-11-2010 12:44,0.85,12576,Poland,10.2,24,29134
503,532556,22601,CHRISTMAS RETROSPOT ANGEL WOOD,12,12-11-2010 12:44,0.85,12576,Poland,10.2,24,29134
504,532556,22595,CHRISTMAS GINGHAM HEART,12,12-11-2010 12:44,0.85,12576,Poland,10.2,24,29134
505,532556,22574,HEART WOODEN CHRISTMAS DECORATION,12,12-11-2010 12:44,0.85,12576,Poland,10.2,24,29134
506,532556,22599,CHRISTMAS MUSICAL ZINC STAR,12,12-11-2010 12:44,0.85,12576,Poland,10.2,24,29134
507,532556,22597,CHRISTMAS MUSICAL ZINC HEART ,12,12-11-2010 12:44,0.85,12576,Poland,10.2,24,29134
508,532556,22336,DOVE DECORATION PAINTED ZINC ,24,12-11-2010 12:44,0.65,12576,Poland,15.6,24,29134
509,532556,21807,WHITE CHRISTMAS STAR DECORATION,36,12-11-2010 12:44,0.42,12576,Poland,15.12,24,29134
510,532556,22294,HEART FILIGREE DOVE  SMALL,24,12-11-2010 12:44,1.25,12576,Poland,30,24,29134
511,532556,22588,CARD HOLDER GINGHAM HEART,6,12-11-2010 12:44,2.55,12576,Poland,15.3,24,29134
512,532626,22845,VINTAGE CREAM CAT FOOD CONTAINER,2,12-11-2010 15:33,6.35,12779,Poland,12.7,23,56463
513,532626,22844,VINTAGE CREAM DOG FOOD CONTAINER,2,12-11-2010 15:33,8.5,12779,Poland,17,23,56463
514,532626,22186,RED STAR CARD HOLDER,6,12-11-2010 15:33,2.95,12779,Poland,17.7,23,56463
515,532626,22121,NOEL WOODEN BLOCK LETTERS ,3,12-11-2010 15:33,5.95,12779,Poland,17.85,23,56463
516,532626,21349,IVY HEART WREATH,2,12-11-2010 15:33,6.75,12779,Poland,13.5,23,56463
517,532626,47559B,TEA TIME OVEN GLOVE,10,12-11-2010 15:33,1.25,12779,Poland,12.5,23,56463
518,532626,20752,BLUE POLKADOT WASHING UP GLOVES,6,12-11-2010 15:33,2.1,12779,Poland,12.6,23,56463
519,532626,21926,RED/CREAM STRIPE CUSHION COVER ,12,12-11-2010 15:33,1.25,12779,Poland,15,23,56463
520,532626,21927,BLUE/CREAM STRIPE CUSHION COVER ,12,12-11-2010 15:33,1.25,12779,Poland,15,23,56463
521,532626,22865,HAND WARMER OWL DESIGN,12,12-11-2010 15:33,2.1,12779,Poland,25.2,23,56463
522,532626,22866,HAND WARMER SCOTTY DOG DESIGN,12,12-11-2010 15:33,2.1,12779,Poland,25.2,23,56463
523,532626,22169,FAMILY ALBUM WHITE PICTURE FRAME,2,12-11-2010 15:33,8.5,12779,Poland,17,23,56463
524,532626,84913A,SOFT PINK ROSE TOWEL ,4,12-11-2010 15:33,4.65,12779,Poland,18.6,23,56463
525,532626,84849B,FAIRY SOAP SOAP HOLDER,12,12-11-2010 15:33,1.69,12779,Poland,20.28,23,56463
526,532626,22195,LARGE HEART MEASURING SPOONS,12,12-11-2010 15:33,1.65,12779,Poland,19.8,23,56463
527,532626,22690,DOORMAT HOME SWEET HOME BLUE ,2,12-11-2010 15:33,7.95,12779,Poland,15.9,23,56463
528,532626,48184,DOORMAT ENGLISH ROSE ,2,12-11-2010 15:33,7.95,12779,Poland,15.9,23,56463
529,532626,84970S,HANGING HEART ZINC T-LIGHT HOLDER,12,12-11-2010 15:33,0.85,12779,Poland,10.2,23,56463
530,532626,21733,RED HANGING HEART T-LIGHT HOLDER,6,12-11-2010 15:33,2.95,12779,Poland,17.7,23,56463
531,532626,22572,ROCKING HORSE GREEN CHRISTMAS ,36,12-11-2010 15:33,0.85,12779,Poland,30.6,23,56463
532,532626,22593,CHRISTMAS GINGHAM STAR,12,12-11-2010 15:33,0.85,12779,Poland,10.2,23,56463
