,InvoiceNo,Stock Code,Description,Quantity,InvoiceDate,UnitPrice,Customer ID,Country,TotalAmount,Age,Salary
533,532626,22594,CHRISTMAS GINGHAM TREE,12,12-11-2010 15:33,0.85,12779,Poland,10.2,23,56463
534,532626,22059,CERAMIC STRAWBERRY DESIGN MUG,12,12-11-2010 15:33,1.49,12779,Poland,17.88,23,56463
535,532626,22057,CERAMIC PLATE STRAWBERRY DESIGN,12,12-11-2010 15:33,1.49,12779,Poland,17.88,23,56463
536,532626,37447,CERAMIC CAKE DESIGN SPOTTED PLATE,12,12-11-2010 15:33,1.49,12779,Poland,17.88,23,56463
537,532626,22571,ROCKING HORSE RED CHRISTMAS ,36,12-11-2010 15:33,0.85,12779,Poland,30.6,23,56463
538,532626,22694,WICKER STAR ,6,12-11-2010 15:33,2.1,12779,Poland,12.6,23,56463
539,532626,20712,JUMBO BAG WOODLAND ANIMALS,10,12-11-2010 15:33,1.95,12779,Poland,19.5,23,56463
540,532626,21232,STRAWBERRY CERAMIC TRINKET BOX,12,12-11-2010 15:33,1.25,12779,Poland,15,23,56463
541,532626,37450,CERAMIC CAKE BOWL + HANGING CAKES,6,12-11-2010 15:33,2.95,12779,Poland,17.7,23,56463
542,532626,22055,MINI CAKE STAND  HANGING STRAWBERY,8,12-11-2010 15:33,1.65,12779,Poland,13.2,23,56463
543,532626,22624,IVORY KITCHEN SCALES,2,12-11-2010 15:33,8.5,12779,Poland,17,23,56463
544,536971,21733,RED HANGING HEART T-LIGHT HOLDER,32,03-12-2010 13:40,2.55,12779,Poland,81.6,23,56463
545,536971,21232,STRAWBERRY CERAMIC TRINKET BOX,24,03-12-2010 13:40,1.25,12779,Poland,30,23,56463
546,536971,37446,MINI CAKE STAND WITH HANGING CAKES,8,03-12-2010 13:40,1.45,12779,Poland,11.6,23,56463
547,536971,37448,CERAMIC CAKE DESIGN SPOTTED MUG,24,03-12-2010 13:40,1.49,12779,Poland,35.76,23,56463
548,536971,21700,BIG DOUGHNUT FRIDGE MAGNETS,24,03-12-2010 13:40,0.85,12779,Poland,20.4,23,56463
549,536971,22844,VINTAGE CREAM DOG FOOD CONTAINER,4,03-12-2010 13:40,8.5,12779,Poland,34,23,56463
550,536971,22961,JAM MAKING SET PRINTED,12,03-12-2010 13:40,1.45,12779,Poland,17.4,23,56463
551,536971,22969,HOMEMADE JAM SCENTED CANDLES,12,03-12-2010 13:40,1.45,12779,Poland,17.4,23,56463
552,537626,85116,BLACK CANDELABRA T-LIGHT HOLDER,12,07-12-2010 14:57,2.1,12347,Iceland,25.2,53,98522
553,537626,22375,AIRLINE BAG VINTAGE JET SET BROWN,4,07-12-2010 14:57,4.25,12347,Iceland,17,53,98522
554,537626,71477,COLOUR GLASS. STAR T-LIGHT HOLDER,12,07-12-2010 14:57,3.25,12347,Iceland,39,53,98522
555,537626,22492,MINI PAINT SET VINTAGE ,36,07-12-2010 14:57,0.65,12347,Iceland,23.4,53,98522
556,537626,22771,CLEAR DRAWER KNOB ACRYLIC EDWARDIAN,12,07-12-2010 14:57,1.25,12347,Iceland,15,53,98522
557,537626,22772,PINK DRAWER KNOB ACRYLIC EDWARDIAN,12,07-12-2010 14:57,1.25,12347,Iceland,15,53,98522
558,537626,22773,GREEN DRAWER KNOB ACRYLIC EDWARDIAN,12,07-12-2010 14:57,1.25,12347,Iceland,15,53,98522
559,537626,22774,RED DRAWER KNOB ACRYLIC EDWARDIAN,12,07-12-2010 14:57,1.25,12347,Iceland,15,53,98522
560,537626,22775,PURPLE DRAWERKNOB ACRYLIC EDWARDIAN,12,07-12-2010 14:57,1.25,12347,Iceland,15,53,98522
561,537626,22805,BLUE DRAWER KNOB ACRYLIC EDWARDIAN,12,07-12-2010 14:57,1.25,12347,Iceland,15,53,98522
562,537626,22725,ALARM CLOCK BAKELIKE CHOCOLATE,4,07-12-2010 14:57,3.75,12347,Iceland,15,53,98522
563,537626,22726,ALARM CLOCK BAKELIKE GREEN,4,07-12-2010 14:57,3.75,12347,Iceland,15,53,98522
564,537626,22727,ALARM CLOCK BAKELIKE RED ,4,07-12-2010 14:57,3.75,12347,Iceland,15,53,98522
565,537626,22728,ALARM CLOCK BAKELIKE PINK,4,07-12-2010 14:57,3.75,12347,Iceland,15,53,98522
566,537626,22729,ALARM CLOCK BAKELIKE ORANGE,4,07-12-2010 14:57,3.75,12347,Iceland,15,53,98522
567,537626,22212,FOUR HOOK  WHITE LOVEBIRDS,6,07-12-2010 14:57,2.1,12347,Iceland,12.6,53,98522
568,537626,85167B,BLACK GRAND BAROQUE PHOTO FRAME,30,07-12-2010 14:57,1.25,12347,Iceland,37.5,53,98522
569,537626,21171,BATHROOM METAL SIGN ,12,07-12-2010 14:57,1.45,12347,Iceland,17.4,53,98522
570,537626,22195,LARGE HEART MEASURING SPOONS,12,07-12-2010 14:57,1.65,12347,Iceland,19.8,53,98522
571,537626,84969,BOX OF 6 ASSORTED COLOUR TEASPOONS,6,07-12-2010 14:57,4.25,12347,Iceland,25.5,53,98522
572,537626,84997C,BLUE 3 PIECE POLKADOT CUTLERY SET,6,07-12-2010 14:57,3.75,12347,Iceland,22.5,53,98522
573,537626,84997B,RED 3 PIECE RETROSPOT CUTLERY SET,6,07-12-2010 14:57,3.75,12347,Iceland,22.5,53,98522
574,537626,84997D,PINK 3 PIECE POLKADOT CUTLERY SET,6,07-12-2010 14:57,3.75,12347,Iceland,22.5,53,98522
575,537626,22494,EMERGENCY FIRST AID TIN ,12,07-12-2010 14:57,1.25,12347,Iceland,15,53,98522
576,537626,22497,SET OF 2 TINS VINTAGE BATHROOM,4,07-12-2010 14:57,4.25,12347,Iceland,17,53,98522
577,537626,85232D,SET/3 DECOUPAGE STACKING TINS,3,07-12-2010 14:57,4.95,12347,Iceland,14.85,53,98522
578,537626,21064,BOOM BOX SPEAKER BOYS,6,07-12-2010 14:57,5.95,12347,Iceland,35.7,53,98522
579,537626,21731,RED TOADSTOOL LED NIGHT LIGHT,12,07-12-2010 14:57,1.65,12347,Iceland,19.8,53,98522
580,537626,84558A,3D DOG PICTURE PLAYING CARDS,24,07-12-2010 14:57,2.95,12347,Iceland,70.8,53,98522
581,537626,20780,BLACK EAR MUFF HEADPHONES,12,07-12-2010 14:57,4.65,12347,Iceland,55.8,53,98522
582,537626,20782,CAMOUFLAGE EAR MUFF HEADPHONES,6,07-12-2010 14:57,5.49,12347,Iceland,32.94,53,98522
